{
  "$schema": "http://json-schema.org/draft-07/schema#",
  "title": "Puppet Action Timeline",
  "description": "Timeline specification for Modern Archivist puppet character actions, expressions, eye states, and mouth movements. Time values are in seconds; fps is used for frame-accurate calculations.",
  "type": "object",
  "required": ["character_id", "fps", "tracks"],
  "properties": {
    "version": {
      "type": "string",
      "description": "Optional semantic version for the timeline format"
    },
    "character_id": {
      "type": "string",
      "description": "Unique identifier for the character (e.g., 'modern_archivist')"
    },
    "fps": {
      "type": "number",
      "minimum": 1,
      "description": "Frames per second for the timeline (e.g., 30)"
    },
    "tracks": {
      "type": "array",
      "minItems": 1,
      "description": "Array of animation tracks specifying state changes over time",
      "items": {
        "type": "object",
        "required": ["type", "from", "to", "value"],
        "properties": {
          "type": {
            "type": "string",
            "enum": ["action", "expression", "eyes", "mouth"],
            "description": "Category of animation track"
          },
          "from": {
            "type": "number",
            "minimum": 0.0,
            "description": "Start time in seconds. Must be less than 'to'."
          },
          "to": {
            "type": "number",
            "minimum": 0.0,
            "description": "End time in seconds. Must be greater than 'from'."
          },
          "value": {
            "type": "string",
            "description": "State value for this track. Must be a valid value in rig_spec.json states for the given type."
          }
        },
        "additionalProperties": false
      }
    }
  },
  "additionalProperties": false
}
