{
  "version": "1.0",
  "character_id": "modern_archivist",
  "fps": 30,
  "tracks": [
    {
      "type": "expression",
      "from": 0.0,
      "to": 8.0,
      "value": "deadpan"
    },
    {
      "type": "action",
      "from": 0.0,
      "to": 1.5,
      "value": "idle"
    },
    {
      "type": "mouth",
      "from": 2.0,
      "to": 2.15,
      "value": "aa"
    },
    {
      "type": "mouth",
      "from": 2.15,
      "to": 2.3,
      "value": "ee"
    },
    {
      "type": "mouth",
      "from": 2.3,
      "to": 2.45,
      "value": "oh"
    },
    {
      "type": "mouth",
      "from": 2.45,
      "to": 2.6,
      "value": "aa"
    },
    {
      "type": "mouth",
      "from": 2.6,
      "to": 2.75,
      "value": "fv"
    },
    {
      "type": "mouth",
      "from": 2.75,
      "to": 2.9,
      "value": "ee"
    },
    {
      "type": "mouth",
      "from": 2.9,
      "to": 3.1,
      "value": "closed"
    },
    {
      "type": "mouth",
      "from": 3.1,
      "to": 3.25,
      "value": "aa"
    },
    {
      "type": "mouth",
      "from": 3.25,
      "to": 3.4,
      "value": "oh"
    },
    {
      "type": "mouth",
      "from": 3.4,
      "to": 3.55,
      "value": "fv"
    },
    {
      "type": "mouth",
      "from": 3.55,
      "to": 3.8,
      "value": "closed"
    },
    {
      "type": "mouth",
      "from": 3.8,
      "to": 4.0,
      "value": "rest"
    },
    {
      "type": "action",
      "from": 5.0,
      "to": 6.4,
      "value": "mug_sip"
    },
    {
      "type": "action",
      "from": 6.4,
      "to": 8.0,
      "value": "idle"
    }
  ]
}
